risk_factor,mechanism,possible_dampener
many_hands,Responsibility is spread across actors procedures and offices,Clear ownership escalation paths and auditability
institutional_betrayal,Trusted authority violates professional moral purpose,Accountable leadership and credible acknowledgment
rule_conscience_conflict,Policy requires action contrary to moral judgment,Ethical discretion exception pathways and appeal processes
scarcity_constraint,Resource limitations block morally adequate action,Staffing resources triage transparency and public accountability
organizational_opacity,Harm pathways are hidden by procedure or hierarchy,Transparent decision records and responsibility mapping
retaliation_risk,Workers fear speaking about moral conflict,Protected voice whistleblower support and psychological safety
bureaucratic_distance,Human need becomes file code case or metric,Relational accountability and client-centered review
repair_failure,Institution refuses to acknowledge or change harm-producing conditions,Institutional courage and structural reform
