risk_factor,mechanism,possible_dampener
moral_justification,Harm is framed as necessary noble protective or efficient,Proportionality review and affected-person impact review
euphemistic_language,Harm is sanitized through technical or bureaucratic language,Plain-language moral description
advantageous_comparison,Wrongdoing is minimized by comparison with worse conduct,Direct moral evaluation of the act itself
responsibility_displacement,Agency is shifted onto orders leaders policy or necessity,Role-specific accountability mapping
responsibility_diffusion,Many actors share the process so no one feels answerable,End-to-end ownership and responsibility mapping
consequence_distortion,Human harm is hidden delayed minimized or abstracted,Human impact tracking and testimony
dehumanization,Targets are treated as less worthy of full moral regard,Humanizing testimony and equal standing safeguards
victim_blaming,Harm is reframed as the victim's fault or deserved consequence,Responsibility restoration and power-aware analysis
