risk_factor,mechanism,possible_dampener
context_collapse,Content reaches audiences beyond intended setting,Context restoration and slower interpretation
visibility_bias,Extreme content appears more representative than it is,Representative data and norm clarification
moralized_misinformation,False or incomplete claims spread through moral urgency,Verification norms and friction before sharing
audience_capture,Users adapt moral expression to rewarding audiences,Private reflection and diverse accountability
dehumanizing_outrage,Targets become symbols or contaminants,Human dignity norms and anti-harassment enforcement
viral_sanction,Public punishment escalates before evidence is complete,Proportionality evidence standards and repair pathways
