risk_factor,mechanism,possible_dampener
punitive_simplification,Punishment is treated as the whole of justice,Repair mapping and victim-centered needs assessment
sentimental_reconciliation,Forgiveness or reconciliation is demanded before truth and safety,Protect victim agency and distinguish forgiveness from reconciliation
symbolic_closure,Public sanction or apology is used to close the case without repair,Track restitution reform and long-term accountability
forgiveness_pressure,Victims are pressured to forgive for others comfort,Respect refusal boundaries and unresolved threat
empty_apology,Regret is expressed without responsibility or amends,Require acknowledgment restitution and changed conduct
institutional_self_protection,Organizations use repair language to protect reputation,Independent investigation and public accountability
restorative_coercion,Restorative processes are imposed despite power imbalance or danger,Voluntary participation safeguards and trauma-informed process
selective_punishment,Powerless actors are punished while powerful actors are protected,Equal standards transparent procedures and oversight
