design_type,strength,risk,best_use
vignette_experiment,Causal control over moral scenario features,May not predict real-world behavior,Testing specific judgment mechanisms
behavioral_task,Observed moral choice under structured conditions,Meaning and stakes may be ambiguous,Studying action tendencies and judgment-action gaps
cross_sectional_developmental,Efficient age group comparison,Cohort effects and contextual confounding,Mapping age-related differences
longitudinal_developmental,Tracks within-person change,Attrition and repeated-measure effects,Studying moral development over time
cross_cultural_comparison,Tests generalizability across moral worlds,Translation and construct equivalence challenges,Extending findings beyond narrow samples
multi_method_assessment,Triangulates judgment emotion action and identity,More expensive and complex,Studying layered moral constructs
